{
  "schema": "token-firewall/evaluation-protocol@0.1",
  "object_id": "eval_token_firewall_calibration_001",
  "revision": 1,
  "created_at": "2026-07-11T00:00:00+08:00",
  "content_sha256": "1e61ef11c44f04b70167953f1e1d2e78391b4642370ef3b0bbdf3fe8c5757ddf",
  "experiment_id": "token-firewall-calibration-001",
  "control_arm": {
    "arm_id": "D-sol-direct",
    "route": ["Sol implementer", "Sol reviewer"]
  },
  "experiment_arm": {
    "arm_id": "A-token-firewall",
    "route": ["MiniMax M3 implementer", "Terra verifier", "Sol reviewer"]
  },
  "primary_outcome": {
    "name": "task_success",
    "noninferiority_margin_percentage_points": 5,
    "critical_regressions_allowed": 0
  },
  "cost_outcome": {
    "name": "cumulative_sol_tokens",
    "minimum_sol_savings_percent": 70
  },
  "sampling": {
    "minimum_pairs": 12,
    "bootstrap_samples": 2000,
    "random_seed": 20260711,
    "risk_levels": ["low", "medium", "high"],
    "task_types": ["bugfix", "feature", "refactor", "integration"]
  },
  "blinding": {
    "candidate_identity_hidden": true,
    "fresh_reviewer_session": true,
    "hidden_tests_after_model_stages": true
  },
  "accounting": {
    "include_failures": true,
    "include_rework": true,
    "deduplicate_by": "session_id"
  },
  "reporting": {
    "confidence_level": 0.95,
    "charts": ["quality_token_pareto", "paired_quality", "risk_strata", "token_waterfall"]
  }
}
