{
  "accounting": {
    "deduplicate_by": "session_id",
    "include_failures": true,
    "include_rework": true
  },
  "blinding": {
    "candidate_identity_hidden": true,
    "fresh_reviewer_session": true,
    "hidden_tests_after_model_stages": true
  },
  "content_sha256": "df8469baf945e19e80d16fd479369489a270a2eb8e722fed2e06585e107faa7b",
  "control_arm": {
    "arm_id": "D",
    "route": [
      "Sol implementer",
      "Sol reviewer"
    ]
  },
  "cost_outcome": {
    "minimum_sol_savings_percent": 70,
    "name": "cumulative_sol_tokens"
  },
  "created_at": "2026-07-11T23:08:00+08:00",
  "experiment_arm": {
    "arm_id": "E",
    "route": [
      "Claude Sonnet implementer",
      "fresh Claude Sonnet verifier",
      "Sol reviewer"
    ]
  },
  "experiment_id": "token-firewall-claude-route-002",
  "object_id": "eval_token_firewall_claude_route_002",
  "primary_outcome": {
    "critical_regressions_allowed": 0,
    "name": "task_success",
    "noninferiority_margin_percentage_points": 5
  },
  "reporting": {
    "charts": [
      "quality_token_pareto",
      "paired_quality",
      "risk_strata",
      "token_waterfall"
    ],
    "confidence_level": 0.95
  },
  "revision": 2,
  "sampling": {
    "bootstrap_samples": 2000,
    "minimum_pairs": 12,
    "random_seed": 20260711,
    "risk_levels": [
      "low",
      "medium",
      "high"
    ],
    "task_types": [
      "bugfix",
      "feature",
      "refactor",
      "integration"
    ]
  },
  "schema": "token-firewall/evaluation-protocol@0.1"
}
